{
  "schema_version":"1.0","id":"taveren-vaen-v0-1","slug":"taveren-vaen","name":"T’averen Vaen","profile_kind":"world","world":"A later Turning of the Wheel","world_slug":"taveren-vaen","version":"0.1","status":"seed","route":"/arkfire.html?profile=taveren-vaen",
  "identity":{"tone":"Pattern-aware, travelled, mending-oriented, alert without strain, dream-capable","shape":"One travelling thread becomes a living loom while the road remains audible beneath it","intention":"Support drafting, Dreamwalker imagery, service-oriented magic, and later-Turning world inhabitation","arrival_signature":"Road ambience and wheel drone gather into interlocking thread pulses around Kestrelle al’Valari’s Wise Woman motif","return_signature":"The loom unthreads in reverse until only road, kettle-room warmth, and one Mending cadence remain","palette":["heather","old gold","road dust","herb green","dream silver"],"canon_sources":["Notion World Reception Profile — T’averen Vaen","Kestrelle al’Valari canon"],"must_avoid":["generic medieval tavern music","demanding percussion","copying earlier-Age Aes Sedai motifs"]},
  "master_clock":{"base_hz":3,"sync_mode":"mixed","macro_cycle_seconds":96},
  "claims":[{"label":"symbolic-canon","text":"Interlocking cycles represent the Pattern and Mending rather than literal fate manipulation."},{"label":"subjective-intention","text":"The rhythm is designed to support alertness without strain."}],
  "layers":[
    {"id":"road-bed","label":"Travelling Road","type":"noise","role":"ordinary-world foundation","gain_db":-38,"enabled_by_default":true,"signal":{"noise_type":"pink","filter":{"type":"lowpass","min_hz":240,"max_hz":620,"cycle_seconds":96}},"routing":{"mode":"center","pan":0},"phase_continuous":true,"symbolic_meaning":"The road beneath the Pattern","experiential_intention":"steady forward continuity","evidence_label":"symbolic-canon","collision_policy":"none","accessibility_notes":[]},
    {"id":"wheel-drone","label":"Wheel Drone","type":"pad","role":"pattern foundation","gain_db":-36,"enabled_by_default":true,"signal":{"waveform":"triangle","frequency_hz":120,"filter":{"type":"lowpass","min_hz":150,"max_hz":360,"cycle_seconds":96}},"modulation":{"kind":"tremolo","rate_hz":0.125,"depth":0.18},"routing":{"mode":"center","pan":0},"phase_continuous":true,"symbolic_meaning":"The Wheel turns beneath the age","experiential_intention":"slow patterned movement","evidence_label":"symbolic-canon","collision_policy":"none","accessibility_notes":[]},
    {"id":"loom-threads","label":"Loom Threads","type":"pad","role":"arrival lattice","gain_db":-38,"enabled_by_default":true,"signal":{"waveform":"triangle","frequency_hz":360,"filter":{"type":"lowpass","min_hz":420,"max_hz":900,"cycle_seconds":32}},"modulation":{"kind":"stereo-drift","rate_hz":0.03125,"depth":0.3},"routing":{"mode":"stereo-drift","pan":0},"phase_continuous":true,"symbolic_meaning":"Interlocking threads of the Pattern","experiential_intention":"several cycles becoming one field","evidence_label":"symbolic-canon","collision_policy":"intentional-harmonic","accessibility_notes":["Reduced-motion centres the threads"]},
    {"id":"mending-return","label":"Mending Cadence","type":"cue","role":"return cue","gain_db":-36,"enabled_by_default":true,"signal":{"waveform":"sine","frequency_hz":480},"routing":{"mode":"center","pan":0},"phase_continuous":true,"symbolic_meaning":"Mending rather than Breaking","experiential_intention":"stable return to service and road","evidence_label":"symbolic-canon","collision_policy":"intentional-harmonic","accessibility_notes":["Soft onset"]}
  ],
  "phases":[
    {"id":"baseline","label":"Baseline","duration_seconds":60,"purpose":"Establish the travelling road.","layer_states":{"road-bed":{"enabled":true,"gain_db":-44}}},
    {"id":"vestibule","label":"Pattern Vestibule","duration_seconds":180,"purpose":"Bring in the Wheel without demanding attention.","layer_states":{"road-bed":{"enabled":true},"wheel-drone":{"enabled":true}}},
    {"id":"arrival","label":"Thread Arrival","duration_seconds":120,"purpose":"Let one thread become several interlocking cycles.","layer_states":{"road-bed":{"enabled":true},"wheel-drone":{"enabled":true},"loom-threads":{"enabled":true}}},
    {"id":"immersion","label":"Mending Immersion","duration_seconds":900,"purpose":"Support drafting, Dreamwalking, and later-Turning inhabitation.","layer_states":{"road-bed":{"enabled":true},"wheel-drone":{"enabled":true},"loom-threads":{"enabled":true}}},
    {"id":"return","label":"Wheelward Return","duration_seconds":180,"purpose":"Unthread toward road, hearth, and Mending cadence.","layer_states":{"road-bed":{"enabled":true,"gain_db":-44},"mending-return":{"enabled":true}}}
  ],
  "variants":{"dreamwalker":{"description":"More spatial thread motion; future calibration.","layer_overrides":{}},"waking-road":{"description":"Centred, lower-complexity drafting mode.","layer_overrides":{}}},
  "safety":{"default_master_gain_db":-22,"maximum_master_gain_db":-12,"maximum_duration_minutes":45,"fade_seconds":8,"headphones_required":false,"automatic_start_allowed":false,"notes":["Keep loom rhythm below attention-demand threshold"]},
  "change_control":{"automatic_changes_allowed":false,"change_one_variable_at_a_time":true,"approval_required":true,"calibration_assumptions":["The musical language is provisional"],"open_questions":["How should Tel’aran’rhiod differ from waking-road mode?"]}
}
