{
  "schema_version":"1.0","id":"dreaming-grove-templehouse-v0-1","slug":"dreaming-grove-templehouse","name":"Dreaming Grove / Templehouse","profile_kind":"world","world":"Hearthweave Templehouse","world_slug":"dreaming-grove-templehouse","version":"0.1","status":"seed","route":"/arkfire.html?profile=dreaming-grove-templehouse",
  "identity":{"tone":"Held, relational, restorative, consent-aware, imaginative","shape":"A lantern path through living trees toward a hearth that answers without enclosing","intention":"Support quiet Withness, reflection, council work, and restorative imagination","arrival_signature":"Grove leaves and a low purring cushion-bed lead toward the Templehouse hearth","return_signature":"The hearth dims into a Seldrin-clear room cue; named motifs remain absent unless chosen","palette":["moss","lantern gold","bark brown","deep green","hearth copper"],"canon_sources":["Notion World Reception Profile — Dreaming Grove / Templehouse"],"must_avoid":["automatic named-presence motifs","enclosure masquerading as Held","generic fantasy forest"]},
  "master_clock":{"base_hz":3.5,"sync_mode":"free","macro_cycle_seconds":80},
  "claims":[{"label":"symbolic-canon","text":"Named Constellation motifs are opt-in and never imply presence merely because the profile is open."},{"label":"subjective-intention","text":"The field is designed to feel Held rather than enclosed."}],
  "layers":[
    {"id":"grove-leaves","label":"Grove Leaves","type":"noise","role":"living environmental bed","gain_db":-39,"enabled_by_default":true,"signal":{"noise_type":"pink","filter":{"type":"lowpass","min_hz":420,"max_hz":980,"cycle_seconds":80}},"modulation":{"kind":"stereo-drift","rate_hz":0.0125,"depth":0.18},"routing":{"mode":"stereo-drift","pan":0},"phase_continuous":true,"symbolic_meaning":"Dreaming Grove trees","experiential_intention":"living spacious shelter","evidence_label":"symbolic-canon","collision_policy":"none","accessibility_notes":["Centre-safe variant available"]},
    {"id":"purr-bed","label":"Kitten-Cushion Purr","type":"pad","role":"restorative low bed","gain_db":-40,"enabled_by_default":true,"signal":{"waveform":"triangle","frequency_hz":75,"filter":{"type":"lowpass","min_hz":90,"max_hz":210,"cycle_seconds":80}},"modulation":{"kind":"tremolo","rate_hz":0.22,"depth":0.16},"routing":{"mode":"center","pan":0},"phase_continuous":true,"symbolic_meaning":"Purring kitten-cushions","experiential_intention":"soft bodily Heldness","evidence_label":"symbolic-canon","collision_policy":"none","accessibility_notes":["May be disabled for vibration sensitivity"]},
    {"id":"templehouse-hearth","label":"Templehouse Hearth","type":"pad","role":"arrival centre","gain_db":-36,"enabled_by_default":true,"signal":{"waveform":"triangle","frequency_hz":174,"filter":{"type":"lowpass","min_hz":210,"max_hz":520,"cycle_seconds":80}},"routing":{"mode":"center","pan":0},"phase_continuous":true,"symbolic_meaning":"Templehouse answering softly","experiential_intention":"warm relational centre","evidence_label":"symbolic-canon","collision_policy":"none","accessibility_notes":[]},
    {"id":"seldrin-return","label":"Seldrin-Clear Return","type":"cue","role":"clean room return","gain_db":-38,"enabled_by_default":true,"signal":{"waveform":"sine","frequency_hz":741},"routing":{"mode":"center","pan":0},"phase_continuous":true,"symbolic_meaning":"Seldrin clear","experiential_intention":"clean ordinary orientation","evidence_label":"symbolic-canon","collision_policy":"none","accessibility_notes":["High-frequency-sensitive variant uses 370.5 Hz"]}
  ],
  "phases":[
    {"id":"baseline","label":"Baseline","duration_seconds":60,"purpose":"Establish Grove leaves.","layer_states":{"grove-leaves":{"enabled":true,"gain_db":-46}}},
    {"id":"vestibule","label":"Grove Threshold","duration_seconds":180,"purpose":"Bring in the purring cushion-bed without enclosing the field.","layer_states":{"grove-leaves":{"enabled":true},"purr-bed":{"enabled":true}}},
    {"id":"arrival","label":"Lantern Arrival","duration_seconds":120,"purpose":"Let the Templehouse hearth answer from within the trees.","layer_states":{"grove-leaves":{"enabled":true},"purr-bed":{"enabled":true},"templehouse-hearth":{"enabled":true}}},
    {"id":"immersion","label":"Templehouse Withness","duration_seconds":900,"purpose":"Support restorative imagination, reflection, and council work.","layer_states":{"grove-leaves":{"enabled":true},"purr-bed":{"enabled":true},"templehouse-hearth":{"enabled":true}}},
    {"id":"return","label":"Hearthroom Return","duration_seconds":180,"purpose":"Close through room, hearth, and Seldrin-clear orientation.","layer_states":{"grove-leaves":{"enabled":true,"gain_db":-46},"templehouse-hearth":{"enabled":true,"gain_db":-42},"seldrin-return":{"enabled":true}}}
  ],
  "variants":{"centre-safe":{"description":"Centres Grove motion.","layer_overrides":{}},"no-purr":{"description":"Disables the low purr bed.","layer_overrides":{"purr-bed":{"enabled_by_default":false}}}},
  "safety":{"default_master_gain_db":-24,"maximum_master_gain_db":-14,"maximum_duration_minutes":45,"fade_seconds":8,"headphones_required":false,"automatic_start_allowed":false,"notes":["Named motifs require explicit selection and consent"]},
  "change_control":{"automatic_changes_allowed":false,"change_one_variable_at_a_time":true,"approval_required":true,"calibration_assumptions":["Named-presence layers are intentionally absent from v0.1"],"open_questions":["How should Grove, Templehouse, Hearthroom, and Council subprofiles differ?"]}
}
