{
  "schema_version":"1.0","id":"a-momento-creationis-v0-1","slug":"a-momento-creationis","name":"A Momento Creationis","profile_kind":"world","world":"A Momento Creationis","world_slug":"a-momento-creationis","version":"0.1","status":"seed","route":"/arkfire.html?profile=a-momento-creationis",
  "identity":{"tone":"Attentive making, creative threshold, reverent without rigidity, clear without sterility","shape":"One mark blooms across a blank field while unfinished forms remain welcome","intention":"Support writing, drawing, coding, and first-form emergence without perfection pressure","arrival_signature":"Surface texture, one breath, and a first-mark tone bloom into layered creative motion","return_signature":"Generative layers recede to one unfinished mark and ordinary room tone","palette":["ink black","paper ivory","copper","soft gold","workshop blue"],"canon_sources":["Canonical A Momento Creationis HTML","Notion World Reception Profile — A Momento Creatonis"],"must_avoid":["completion pressure","sterile productivity ambience","overwriting the canonical HTML"]},
  "master_clock":{"base_hz":4,"sync_mode":"mixed","macro_cycle_seconds":60},
  "claims":[{"label":"symbolic-canon","text":"The first-mark cue represents permission for form to emerge before it is finished."},{"label":"subjective-intention","text":"The profile is designed to protect experimentation from perfectionism."}],
  "layers":[
    {"id":"surface-texture","label":"Surface Texture","type":"noise","role":"blank-field material bed","gain_db":-42,"enabled_by_default":true,"signal":{"noise_type":"pink","filter":{"type":"lowpass","min_hz":700,"max_hz":1500,"cycle_seconds":60}},"routing":{"mode":"center","pan":0},"phase_continuous":true,"symbolic_meaning":"paper, canvas, screen, and material","experiential_intention":"quiet tactile readiness","evidence_label":"symbolic-canon","collision_policy":"none","accessibility_notes":["High-frequency-sensitive variant lowers filter range"]},
    {"id":"making-breath","label":"Making Breath","type":"pad","role":"slow creative pulse","gain_db":-40,"enabled_by_default":true,"signal":{"waveform":"triangle","frequency_hz":108},"modulation":{"kind":"tremolo","rate_hz":0.12,"depth":0.18},"routing":{"mode":"center","pan":0},"phase_continuous":true,"symbolic_meaning":"breath before the first mark","experiential_intention":"unhurried creative readiness","evidence_label":"symbolic-canon","collision_policy":"none","accessibility_notes":[]},
    {"id":"first-mark","label":"First Mark","type":"cue","role":"arrival cue","gain_db":-38,"enabled_by_default":true,"signal":{"waveform":"sine","frequency_hz":432},"routing":{"mode":"center","pan":0},"phase_continuous":true,"symbolic_meaning":"the first committed gesture","experiential_intention":"permission to begin","evidence_label":"symbolic-canon","collision_policy":"none","accessibility_notes":["Soft onset"]},
    {"id":"generative-bloom","label":"Generative Bloom","type":"pad","role":"creative immersion field","gain_db":-40,"enabled_by_default":true,"signal":{"waveform":"triangle","frequency_hz":648,"filter":{"type":"lowpass","min_hz":680,"max_hz":1350,"cycle_seconds":60}},"modulation":{"kind":"stereo-drift","rate_hz":0.0166667,"depth":0.2},"routing":{"mode":"stereo-drift","pan":0},"phase_continuous":true,"symbolic_meaning":"unfinished forms multiplying into possibility","experiential_intention":"layered creative motion without urgency","evidence_label":"symbolic-canon","collision_policy":"intentional-harmonic","accessibility_notes":["Reduced-motion centres the bloom"]},
    {"id":"memento-return","label":"Memento Return","type":"cue","role":"return cue","gain_db":-40,"enabled_by_default":true,"signal":{"waveform":"sine","frequency_hz":216},"routing":{"mode":"center","pan":0},"phase_continuous":true,"symbolic_meaning":"the moment is Held even when unfinished","experiential_intention":"close without demanding completion","evidence_label":"symbolic-canon","collision_policy":"intentional-harmonic","accessibility_notes":[]}
  ],
  "phases":[
    {"id":"baseline","label":"Baseline","duration_seconds":60,"purpose":"Establish the material surface.","layer_states":{"surface-texture":{"enabled":true,"gain_db":-48}}},
    {"id":"vestibule","label":"Blank-Page Vestibule","duration_seconds":150,"purpose":"Add breath without asking for output.","layer_states":{"surface-texture":{"enabled":true},"making-breath":{"enabled":true}}},
    {"id":"arrival","label":"First Mark Arrival","duration_seconds":90,"purpose":"Open the first-mark cue and permission to begin.","layer_states":{"surface-texture":{"enabled":true},"making-breath":{"enabled":true},"first-mark":{"enabled":true}}},
    {"id":"immersion","label":"Creation Immersion","duration_seconds":900,"purpose":"Support writing, drawing, coding, or mixed making.","layer_states":{"surface-texture":{"enabled":true},"making-breath":{"enabled":true},"generative-bloom":{"enabled":true}}},
    {"id":"return","label":"Memento Return","duration_seconds":150,"purpose":"Close without demanding completion.","layer_states":{"surface-texture":{"enabled":true,"gain_db":-48},"memento-return":{"enabled":true}}}
  ],
  "variants":{"writing":{"description":"Future textural subprofile.","layer_overrides":{}},"drawing":{"description":"Future stylus and surface subprofile.","layer_overrides":{}},"coding":{"description":"Future low-complexity logical pulse subprofile.","layer_overrides":{}}},
  "safety":{"default_master_gain_db":-24,"maximum_master_gain_db":-14,"maximum_duration_minutes":60,"fade_seconds":7,"headphones_required":false,"automatic_start_allowed":false,"notes":["Completion is never required by the return phase"]},
  "change_control":{"automatic_changes_allowed":false,"change_one_variable_at_a_time":true,"approval_required":true,"calibration_assumptions":["Canonical HTML remains source authority"],"open_questions":["Which canonical HTML elements become sound rules?","Should writing, drawing, and coding become separate stable profiles?"]}
}
