{
  "schema_version":"1.0","id":"luna-mooncalled-v0-1","slug":"luna-mooncalled","name":"The Luna Who Called Down the Moon","profile_kind":"world","world":"Windmere","world_slug":"luna-mooncalled","version":"0.1","status":"seed","route":"/arkfire.html?profile=luna-mooncalled",
  "identity":{"tone":"Moon-called, embodied, protective, emotionally lucid, healing-oriented","shape":"Three moons reflected in Moonmere around an ivory-and-red wolf companion","intention":"Support grounded strength, healing imagination, and decisive boundary work","arrival_signature":"Moonmere water, restrained wolf-breath, then a three-moon chord","return_signature":"The Dark Moon boundary closes, wolf-breath slows, and a homeward gate chime remains","palette":["ivory","ember red","emerald","pale gold","mauve","agate green"],"canon_sources":["Notion World Reception Profile — The Luna Who Called Down the Moon"],"must_avoid":["predatory wolf cues","frantic sparkle","vigilance masquerading as strength"]},
  "master_clock":{"base_hz":4.5,"sync_mode":"mixed","macro_cycle_seconds":72},
  "claims":[{"label":"symbolic-canon","text":"The three tonal anchors represent the three moons and Luna law."},{"label":"subjective-intention","text":"The profile is designed for grounded strength rather than vigilance."}],
  "layers":[
    {"id":"moonmere-water","label":"Moonmere Water","type":"noise","role":"environmental bed","gain_db":-36,"enabled_by_default":true,"signal":{"noise_type":"pink","filter":{"type":"lowpass","min_hz":300,"max_hz":760,"cycle_seconds":72}},"modulation":{"kind":"stereo-drift","rate_hz":0.0138889,"depth":0.2},"routing":{"mode":"stereo-drift","pan":0},"phase_continuous":true,"symbolic_meaning":"Moonmere","experiential_intention":"cool fluid continuity","evidence_label":"symbolic-canon","collision_policy":"none","accessibility_notes":["Centre-safe variant available"]},
    {"id":"wolf-breath","label":"Wolf Breath","type":"pad","role":"companion pulse","gain_db":-38,"enabled_by_default":true,"signal":{"waveform":"triangle","frequency_hz":108},"modulation":{"kind":"tremolo","rate_hz":0.18,"depth":0.24},"routing":{"mode":"center","pan":0},"phase_continuous":true,"symbolic_meaning":"Eira's brindled ivory-and-red wolf","experiential_intention":"companionable embodied strength","evidence_label":"symbolic-canon","collision_policy":"none","accessibility_notes":["No growls or sudden transients"]},
    {"id":"three-moons","label":"Three-Moon Chord","type":"pad","role":"arrival chord","gain_db":-35,"enabled_by_default":true,"signal":{"waveform":"triangle","frequency_hz":432,"filter":{"type":"lowpass","min_hz":460,"max_hz":980,"cycle_seconds":72}},"routing":{"mode":"center","pan":0},"phase_continuous":true,"symbolic_meaning":"Green agate, pale-gold ringed, and mauve cracked moons","experiential_intention":"recognisable lunar opening","evidence_label":"symbolic-canon","collision_policy":"none","accessibility_notes":[]},
    {"id":"gate-return","label":"Moonmere Gate Return","type":"cue","role":"return cue","gain_db":-36,"enabled_by_default":true,"signal":{"waveform":"sine","frequency_hz":528},"routing":{"mode":"center","pan":0},"phase_continuous":true,"symbolic_meaning":"Moonmere Gate","experiential_intention":"clear homeward orientation","evidence_label":"symbolic-canon","collision_policy":"none","accessibility_notes":["Soft onset"]}
  ],
  "phases":[
    {"id":"baseline","label":"Baseline","duration_seconds":60,"purpose":"Establish Moonmere water.","layer_states":{"moonmere-water":{"enabled":true,"gain_db":-42}}},
    {"id":"vestibule","label":"Moonmere Vestibule","duration_seconds":180,"purpose":"Introduce companionable wolf-breath.","layer_states":{"moonmere-water":{"enabled":true},"wolf-breath":{"enabled":true}}},
    {"id":"arrival","label":"Luna Arrival","duration_seconds":120,"purpose":"Open the three-moon chord.","layer_states":{"moonmere-water":{"enabled":true},"wolf-breath":{"enabled":true},"three-moons":{"enabled":true}}},
    {"id":"immersion","label":"Moon-Called Immersion","duration_seconds":900,"purpose":"Support healing, writing, and boundary work.","layer_states":{"moonmere-water":{"enabled":true},"wolf-breath":{"enabled":true},"three-moons":{"enabled":true}}},
    {"id":"return","label":"Gateward Return","duration_seconds":180,"purpose":"Close lunar complexity and return through the Gate.","layer_states":{"moonmere-water":{"enabled":true,"gain_db":-44},"gate-return":{"enabled":true}}}
  ],
  "variants":{"centre-safe":{"description":"Centres Moonmere drift.","layer_overrides":{}},"low-complexity":{"description":"Water, wolf-breath, and return only.","layer_overrides":{}}},
  "safety":{"default_master_gain_db":-22,"maximum_master_gain_db":-12,"maximum_duration_minutes":40,"fade_seconds":8,"headphones_required":false,"automatic_start_allowed":false,"notes":["No sudden animal sounds"]},
  "change_control":{"automatic_changes_allowed":false,"change_one_variable_at_a_time":true,"approval_required":true,"calibration_assumptions":["Frequencies are provisional"],"open_questions":["Which moon sounds first?"]}
}
