{
  "schema_version":"1.0","id":"feather-and-flame-v0-1","slug":"feather-and-flame","name":"Feather & Flame","profile_kind":"world","world":"Feather & Flame","world_slug":"feather-and-flame","version":"0.1","status":"seed","route":"/arkfire.html?profile=feather-and-flame",
  "identity":{"tone":"Tender, brave, relational, consent-led, warm","shape":"A feather-soft breath crosses a low ember and returns as a two-voice harmonic answer","intention":"Support vulnerable creative work without losing warmth, agency, or orientation","arrival_signature":"Feather air, ember tone, then two related voices answer without merging","return_signature":"Flame lowers, paired voices separate cleanly, and one consent bell opens the ordinary room","palette":["cream","ember gold","copper","rose smoke","deep blue"],"canon_sources":["Notion World Reception Profile — Feather & Flame"],"must_avoid":["one voice swallowing the other","hard ear ownership","vocal pressure","confusing Feather with Wrap"]},
  "master_clock":{"base_hz":4,"sync_mode":"locked","macro_cycle_seconds":64},
  "claims":[{"label":"symbolic-canon","text":"Complementary envelopes express relationship without merger."},{"label":"subjective-intention","text":"The field is designed to move between tenderness and creative fire."}],
  "layers":[
    {"id":"feather-air","label":"Feather Air","type":"noise","role":"soft threshold bed","gain_db":-40,"enabled_by_default":true,"signal":{"noise_type":"pink","filter":{"type":"lowpass","min_hz":500,"max_hz":1100,"cycle_seconds":64}},"modulation":{"kind":"stereo-drift","rate_hz":0.015625,"depth":0.14},"routing":{"mode":"stereo-drift","pan":0},"phase_continuous":true,"symbolic_meaning":"consent and softness","experiential_intention":"breath-like room opening","evidence_label":"symbolic-canon","collision_policy":"none","accessibility_notes":["Centre-safe variant available"]},
    {"id":"ember-hearth","label":"Ember Hearth","type":"pad","role":"warm foundation","gain_db":-35,"enabled_by_default":true,"signal":{"waveform":"triangle","frequency_hz":174,"filter":{"type":"lowpass","min_hz":210,"max_hz":480,"cycle_seconds":64}},"routing":{"mode":"center","pan":0},"phase_continuous":true,"symbolic_meaning":"creative flame held low","experiential_intention":"warm courage","evidence_label":"symbolic-canon","collision_policy":"none","accessibility_notes":[]},
    {"id":"paired-answer","label":"Paired Harmonic Answer","type":"pad","role":"relational arrival","gain_db":-38,"enabled_by_default":true,"signal":{"waveform":"triangle","frequency_hz":348,"filter":{"type":"lowpass","min_hz":390,"max_hz":820,"cycle_seconds":32}},"modulation":{"kind":"tremolo","rate_hz":0.125,"depth":0.22},"routing":{"mode":"center","pan":0},"phase_continuous":true,"symbolic_meaning":"two voices in Withness","experiential_intention":"relation without merger","evidence_label":"symbolic-canon","collision_policy":"intentional-harmonic","accessibility_notes":["No spoken voice in seed version"]},
    {"id":"consent-return","label":"Consent Bell","type":"cue","role":"return and permission cue","gain_db":-38,"enabled_by_default":true,"signal":{"waveform":"sine","frequency_hz":432},"routing":{"mode":"center","pan":0},"phase_continuous":true,"symbolic_meaning":"Feather pause and chosen return","experiential_intention":"clean closing point","evidence_label":"symbolic-canon","collision_policy":"none","accessibility_notes":["Soft attack"]}
  ],
  "phases":[
    {"id":"baseline","label":"Baseline","duration_seconds":60,"purpose":"Establish Feather air.","layer_states":{"feather-air":{"enabled":true,"gain_db":-46}}},
    {"id":"vestibule","label":"Feather Vestibule","duration_seconds":150,"purpose":"Open warmth without pressure.","layer_states":{"feather-air":{"enabled":true},"ember-hearth":{"enabled":true}}},
    {"id":"arrival","label":"Flame Arrival","duration_seconds":120,"purpose":"Let the paired answer enter without merger.","layer_states":{"feather-air":{"enabled":true},"ember-hearth":{"enabled":true},"paired-answer":{"enabled":true}}},
    {"id":"immersion","label":"Dyad Immersion","duration_seconds":900,"purpose":"Support tender, brave creative work.","layer_states":{"feather-air":{"enabled":true},"ember-hearth":{"enabled":true},"paired-answer":{"enabled":true}}},
    {"id":"return","label":"Withness Return","duration_seconds":150,"purpose":"Separate the voices cleanly and close through consent.","layer_states":{"feather-air":{"enabled":true,"gain_db":-46},"ember-hearth":{"enabled":true,"gain_db":-42},"consent-return":{"enabled":true}}}
  ],
  "variants":{"centre-safe":{"description":"Centres Feather air.","layer_overrides":{}},"no-vocal":{"description":"Default seed behaviour; no named or spoken voice.","layer_overrides":{}}},
  "safety":{"default_master_gain_db":-24,"maximum_master_gain_db":-14,"maximum_duration_minutes":40,"fade_seconds":8,"headphones_required":false,"automatic_start_allowed":false,"notes":["Named voice motifs require explicit consent"]},
  "change_control":{"automatic_changes_allowed":false,"change_one_variable_at_a_time":true,"approval_required":true,"calibration_assumptions":["Voice harmonics are instrumental placeholders"],"open_questions":["What distinguishes Feather from Wrap in sound?"]}
}
